{
  "$schema": "./schema.json",
  "name": "IRequestContext",
  "namespace": "DcsvIo.D2.Context.Abstractions",
  "description": "Per-request runtime context. Extends IAuthContext with transport-level (tracing) and network/enrichment information. Populated by transport-specific middleware (aspnetcore for HTTP, messaging-rabbitmq for RabbitMQ, etc.) into a MutableRequestContext concrete instance; downstream consumers see only the read-only IRequestContext interface.",
  "extends": "DcsvIo.D2.AuthContext.Abstractions.IAuthContext",
  "sections": [
    {
      "name": "Tracing",
      "properties": [
        {
          "name": "TraceId",
          "type": "string?",
          "doc": "Trace identifier for this request. Sourced from Activity.Current?.TraceId (HTTP) or AMQP traceparent header (messaging). Auto-injected into D2Result by BaseHandler so cross-service correlation works."
        },
        {
          "name": "RequestId",
          "type": "string?",
          "propagate": true,
          "maxLength": 256,
          "doc": "Per-request unique identifier (HttpContext.TraceIdentifier for HTTP; message-id property for AMQP)."
        },
        {
          "name": "RequestPath",
          "type": "string?",
          "propagate": true,
          "maxLength": 2048,
          "doc": "Request path (HTTP) or routing key (AMQP) - descriptive context for logs."
        },
        {
          "name": "HttpMethod",
          "type": "string?",
          "doc": "HTTP verb captured by the entry service's middleware (e.g. 'GET', 'POST', 'PUT'). Only meaningful at the HTTP edge - downstream gRPC and AMQP consumers do not carry the originating HTTP verb, so this field does NOT propagate. Null on non-HTTP transports."
        },
        {
          "name": "RequestStartedAt",
          "type": "DateTimeOffset?",
          "propagate": true,
          "doc": "Timestamp when the entry service began processing the originating request (Category 1 - past UTC instant). Propagates so async consumers, such as audit recording, can report end-to-end SLA latency. Domain consumers MUST convert to NodaTime.Instant at the consumption boundary before any temporal arithmetic: dto.Value.ToInstant(). Wire form is DateTimeOffset? for JSON-serialization interop."
        },
        {
          "name": "IdempotencyKey",
          "type": "string?",
          "propagate": true,
          "maxLength": 255,
          "redact": true,
          "doc": "Parsed value of the Idempotency-Key request header. Propagates so downstream consumers correlate idempotent retries across the call chain. Max 255 chars; values exceeding cap are rejected by the entry service's middleware with 400 Bad Request. Treat as opaque - do NOT log the raw value; structured logs may emit a SHA-256 prefix for correlation but never the literal value."
        }
      ]
    },
    {
      "name": "Network",
      "properties": [
        {
          "name": "ClientIp",
          "type": "string?",
          "redact": true,
          "doc": "Resolved client IP - precedence CF-Connecting-IP > X-Real-IP > X-Forwarded-For (last entry) > Connection.RemoteIpAddress. Null for non-HTTP transports."
        }
      ]
    },
    {
      "name": "Fingerprints",
      "properties": [
        {
          "name": "SessionFingerprint",
          "type": "string?",
          "claim": "d2_fp",
          "propagate": true,
          "maxLength": 512,
          "doc": "The fingerprint that was bound to this session at JWT mint time (the d2_fp claim). Format: 'v{N}.c1.c2.c3.c4.c5.s1.s2.s3.s4.s5' - leading version token then 10 component hashes (5 client-side: FingerprintJS-OSS, WebGL renderer, speech voices, media devices, extended fonts; 5 server-side: HTTP/2 SETTINGS frame, header order, Sec-CH-UA, Accept-Encoding, Accept-Language). Each component hash is the 16-hex-character prefix of a SHA-256 digest. Stable across all requests in a session. Propagated to async consumers, such as audit recording, via the cross-hop x-d2-context header - never as plaintext caller identity (broker stays blind to identity)."
        },
        {
          "name": "CurrentFingerprint",
          "type": "string?",
          "propagate": true,
          "maxLength": 512,
          "doc": "The fingerprint recomputed for THIS request by the entry service's fingerprint middleware, in the same dot-separated format as SessionFingerprint. Captures the actual device fingerprint of the originating request (vs the session-bound one). Propagated via x-d2-context so audit rows for async-triggered actions record the originating request's actual fingerprint - not just what the session was bound to."
        },
        {
          "name": "RiskScore",
          "type": "int?",
          "propagate": true,
          "doc": "Composite request-risk score (0-100; higher = more risky) computed by the entry service's risk engine for THIS request. Inputs include geo-velocity drift from the sign-in baseline, ASN reputation, Tor / proxy / hosting flags, per-org and per-user policy contributions, and fingerprint-mismatch components (SessionFingerprint vs CurrentFingerprint). 0 = no risk; >= user/org step-up threshold = OTP step-up; >= user/org block threshold = block + invalidate session. Null on internal services and pre-risk-engine paths. Propagated via x-d2-context so audit rows record the risk engine's verdict at the moment of the originating request. The entry service defines the contribution math + thresholds; consumer-side libraries only read this field, never compute it."
        },
        {
          "name": "DeviceKey",
          "type": "string?",
          "redact": true,
          "propagate": true,
          "maxLength": 128,
          "doc": "Opaque portable device identifier bound at session establish when known (sticky device continuity). Max 128 chars. Mandatory redact (PersonalInformation) - treat as correlating device id, never log the raw value. Propagates so async audit can correlate the same device across hops without carrying fingerprint component material."
        },
        {
          "name": "DeviceConfidence",
          "type": "string?",
          "maxLength": 32,
          "doc": "Portable device-confidence class as a closed string wire vocabulary: High | Common | LowHostile (string equality only; no invented synonyms). Not propagated - evaluated at the request-establishment boundary for this hop. Null when confidence is unknown or unset."
        }
      ]
    },
    {
      "name": "Infrastructure",
      "properties": [
        {
          "name": "EdgeNodeId",
          "type": "string?",
          "propagate": true,
          "doc": "Process identifier of the entry service (e.g. Kubernetes pod name, EC2 instance id, or region+node tuple). Captured once at that process's boot by startup middleware. Propagates via x-d2-context so downstream audit and telemetry know which entry node originated the request - important for hot-spot diagnosis and capacity attribution."
        }
      ]
    },
    {
      "name": "User Preferences",
      "properties": [
        {
          "name": "LocaleIetfBcp47Tag",
          "type": "string?",
          "propagate": true,
          "doc": "Resolved user locale as an IETF BCP 47 tag (e.g. 'en-US', 'zh-Hans-SG'). Populated by the entry service's auth middleware via the locale cascade: user profile preference > org default preference > X-D2-Locale header > Accept-Language header > fallback 'en-US'. Propagates so async consumers, such as email and notification delivery, render locale-aware content. Validation of the BCP 47 tag is performed by the LocaleCode typed wrapper at the consumption site."
        },
        {
          "name": "TimezoneIanaName",
          "type": "string?",
          "propagate": true,
          "doc": "Resolved user timezone as an IANA timezone database name (e.g. 'America/New_York', 'Europe/Berlin'). Populated by the entry service's auth middleware via the timezone cascade: user profile preference > org default preference > X-D2-Timezone header > WhoIs-derived (CountryIso31661Alpha2Code + SubdivisionIso31662Code mapped via DcsvIo.D2.Geo.Default) > fallback 'UTC'. Propagates so async consumers render timezone-aware timestamps."
        },
        {
          "name": "CurrencyIso4217Code",
          "type": "string?",
          "propagate": true,
          "doc": "Resolved user currency as an ISO 4217 code (e.g. 'USD', 'EUR', 'GBP'). Populated by the entry service's auth middleware via the currency cascade: user profile preference > org default preference > X-D2-Currency header > CountryIso31661Alpha2Code-derived (ISO 3166 to ISO 4217 primary legal-tender mapping via DcsvIo.D2.Geo.Default) > fallback NULL (no sensible universal default; consumers surface a validation error when null and a currency is required)."
        }
      ]
    },
    {
      "name": "Entitlements",
      "properties": [
        {
          "name": "OrgPlanTier",
          "type": "string?",
          "propagate": true,
          "doc": "Operating organization plan tier label (e.g. 'Free', 'Starter', 'Pro', 'Enterprise'). Used by handlers gating premium operations. Stored as a free-form string (not an enum) to allow tier names to evolve without a source-gen rebuild cycle - validate at the consumption site. Propagates so async consumers can apply plan-gated logic."
        },
        {
          "name": "FeatureFlagsCsv",
          "type": "string?",
          "propagate": true,
          "doc": "Comma-separated list of active feature flag names for the operating org (e.g. 'new-billing,risk-v2'). Callers split on comma to enumerate active flags. Flag names MUST NOT contain commas - enforced at flag-creation time. CSV form chosen because source-gen does not currently support IReadOnlySet<string> for propagated context fields. Propagates so async consumers can apply flag-gated logic."
        }
      ]
    },
    {
      "name": "WhoIs - Admin Location",
      "properties": [